{
  "clusters": {
    "00_meta": {
      "canonical_paths": [
        "repo/00_meta/meta.skill",
        "repo/00_meta/skill-composer.skill",
        "repo/00_meta/skill-optimiser.skill",
        "repo/00_meta/skill-orchestrator.skill",
        "repo/00_meta/skill-protocol.skill",
        "repo/00_meta/skill-updater.skill",
        "repo/00_meta/system-skill.skill"
      ],
      "members": [
        "meta",
        "skill-composer",
        "skill-optimiser",
        "skill-orchestrator",
        "skill-protocol",
        "skill-updater",
        "system-skill"
      ],
      "size": 7
    },
    "10_reasoning_core": {
      "canonical_paths": [
        "repo/10_reasoning_core/constraints.skill",
        "repo/10_reasoning_core/graph.skill",
        "repo/10_reasoning_core/graph-reasoning.skill",
        "repo/10_reasoning_core/hierarchical-reasoning.skill",
        "repo/10_reasoning_core/ontolog.skill",
        "repo/10_reasoning_core/unifying-graph-analytics.skill"
      ],
      "members": [
        "constraints",
        "graph",
        "graph-reasoning",
        "hierarchical-reasoning",
        "ontolog",
        "unifying-graph-analytics"
      ],
      "size": 6
    },
    "20_saq_medical": {
      "canonical_paths": [
        "repo/20_saq_medical/cicm-saq-rubric.skill",
        "repo/20_saq_medical/pex.skill",
        "repo/20_saq_medical/saq.skill",
        "repo/20_saq_medical/saq-rubric.skill",
        "repo/20_saq_medical/saq-rubric-metaschema.skill",
        "repo/20_saq_medical/saq-schema.skill",
        "repo/20_saq_medical/saq-template-2.skill",
        "repo/20_saq_medical/telos.skill"
      ],
      "members": [
        "cicm-saq-rubric",
        "pex",
        "saq",
        "saq-rubric",
        "saq-rubric-metaschema",
        "saq-schema",
        "saq-template-2",
        "telos"
      ],
      "size": 8
    },
    "30_tools_and_aux": {
      "canonical_paths": [
        "repo/30_tools_and_aux/abduct.skill",
        "repo/30_tools_and_aux/agency.skill",
        "repo/30_tools_and_aux/compound-learning.skill",
        "repo/30_tools_and_aux/critique.skill",
        "repo/30_tools_and_aux/dspy.skill",
        "repo/30_tools_and_aux/eloquence.skill",
        "repo/30_tools_and_aux/lambda.skill",
        "repo/30_tools_and_aux/learn.skill",
        "repo/30_tools_and_aux/non-linear.skill",
        "repo/30_tools_and_aux/obsidian.skill",
        "repo/30_tools_and_aux/process-goals-prompting.skill",
        "repo/30_tools_and_aux/reason.skill",
        "repo/30_tools_and_aux/rpp.skill",
        "repo/30_tools_and_aux/think.skill",
        "repo/30_tools_and_aux/urf.skill"
      ],
      "members": [
        "abduct",
        "agency",
        "compound-learning",
        "critique",
        "dspy",
        "eloquence",
        "lambda",
        "learn",
        "non-linear",
        "obsidian",
        "process-goals-prompting",
        "reason",
        "rpp",
        "think",
        "urf"
      ],
      "size": 15
    }
  },
  "control_graph": {
    "atomic_count": 17,
    "atomic_nodes": [
      "cicm-saq-rubric",
      "compound-learning",
      "eloquence",
      "graph-reasoning",
      "meta",
      "pex",
      "process-goals-prompting",
      "saq-rubric",
      "saq-rubric-metaschema",
      "saq-schema",
      "saq-template-2",
      "skill-optimiser",
      "skill-updater",
      "system-skill",
      "telos",
      "unifying-graph-analytics",
      "urf"
    ],
    "max_depth": 8,
    "node_count": 36,
    "relation_count": 213,
    "relation_kind_counts": {
      "compat_alias": 2,
      "demotion": 72,
      "runtime_hard": 59,
      "runtime_soft": 80
    }
  },
  "generated_at": "2026-02-14T17:31:11.391483Z",
  "nodes": [
    {
      "archive": "repo/30_tools_and_aux/abduct.skill",
      "cluster": "30_tools_and_aux",
      "cluster_ordinal": 30,
      "control_score": 0.309375,
      "control_state": "relay",
      "id": "abduct",
      "is_atomic": false,
      "quality": {
        "hard_in_degree": 3,
        "hard_out_degree": 3,
        "soft_in_degree": 2,
        "soft_out_degree": 0,
        "word_count": 586
      },
      "scc_id": 0
    },
    {
      "archive": "repo/30_tools_and_aux/agency.skill",
      "cluster": "30_tools_and_aux",
      "cluster_ordinal": 30,
      "control_score": 0.268177,
      "control_state": "relay",
      "id": "agency",
      "is_atomic": false,
      "quality": {
        "hard_in_degree": 2,
        "hard_out_degree": 2,
        "soft_in_degree": 1,
        "soft_out_degree": 1,
        "word_count": 604
      },
      "scc_id": 0
    },
    {
      "archive": "repo/20_saq_medical/cicm-saq-rubric.skill",
      "cluster": "20_saq_medical",
      "cluster_ordinal": 20,
      "control_score": 0.15,
      "control_state": "source",
      "id": "cicm-saq-rubric",
      "is_atomic": true,
      "quality": {
        "hard_in_degree": 0,
        "hard_out_degree": 3,
        "soft_in_degree": 0,
        "soft_out_degree": 2,
        "word_count": 444
      },
      "scc_id": 4
    },
    {
      "archive": "repo/30_tools_and_aux/compound-learning.skill",
      "cluster": "30_tools_and_aux",
      "cluster_ordinal": 30,
      "control_score": 0.15,
      "control_state": "source",
      "id": "compound-learning",
      "is_atomic": true,
      "quality": {
        "hard_in_degree": 0,
        "hard_out_degree": 3,
        "soft_in_degree": 0,
        "soft_out_degree": 5,
        "word_count": 708
      },
      "scc_id": 7
    },
    {
      "archive": "repo/10_reasoning_core/constraints.skill",
      "cluster": "10_reasoning_core",
      "cluster_ordinal": 10,
      "control_score": 0.541239,
      "control_state": "relay",
      "id": "constraints",
      "is_atomic": false,
      "quality": {
        "hard_in_degree": 7,
        "hard_out_degree": 2,
        "soft_in_degree": 7,
        "soft_out_degree": 2,
        "word_count": 596
      },
      "scc_id": 0
    },
    {
      "archive": "repo/30_tools_and_aux/critique.skill",
      "cluster": "30_tools_and_aux",
      "cluster_ordinal": 30,
      "control_score": 0.455301,
      "control_state": "relay",
      "id": "critique",
      "is_atomic": false,
      "quality": {
        "hard_in_degree": 4,
        "hard_out_degree": 2,
        "soft_in_degree": 5,
        "soft_out_degree": 3,
        "word_count": 658
      },
      "scc_id": 0
    },
    {
      "archive": "repo/30_tools_and_aux/dspy.skill",
      "cluster": "30_tools_and_aux",
      "cluster_ordinal": 30,
      "control_score": 0.1925,
      "control_state": "relay",
      "id": "dspy",
      "is_atomic": false,
      "quality": {
        "hard_in_degree": 1,
        "hard_out_degree": 1,
        "soft_in_degree": 1,
        "soft_out_degree": 0,
        "word_count": 590
      },
      "scc_id": 0
    },
    {
      "archive": "repo/30_tools_and_aux/eloquence.skill",
      "cluster": "30_tools_and_aux",
      "cluster_ordinal": 30,
      "control_score": 0.15,
      "control_state": "source",
      "id": "eloquence",
      "is_atomic": true,
      "quality": {
        "hard_in_degree": 0,
        "hard_out_degree": 2,
        "soft_in_degree": 0,
        "soft_out_degree": 1,
        "word_count": 681
      },
      "scc_id": 8
    },
    {
      "archive": "repo/10_reasoning_core/graph.skill",
      "cluster": "10_reasoning_core",
      "cluster_ordinal": 10,
      "control_score": 0.824811,
      "control_state": "relay",
      "id": "graph",
      "is_atomic": false,
      "quality": {
        "hard_in_degree": 4,
        "hard_out_degree": 1,
        "soft_in_degree": 14,
        "soft_out_degree": 0,
        "word_count": 674
      },
      "scc_id": 0
    },
    {
      "archive": "repo/10_reasoning_core/graph-reasoning.skill",
      "cluster": "10_reasoning_core",
      "cluster_ordinal": 10,
      "control_score": 0.15,
      "control_state": "source",
      "id": "graph-reasoning",
      "is_atomic": true,
      "quality": {
        "hard_in_degree": 0,
        "hard_out_degree": 2,
        "soft_in_degree": 0,
        "soft_out_degree": 8,
        "word_count": 458
      },
      "scc_id": 10
    },
    {
      "archive": "repo/10_reasoning_core/hierarchical-reasoning.skill",
      "cluster": "10_reasoning_core",
      "cluster_ordinal": 10,
      "control_score": 1.125449,
      "control_state": "relay",
      "id": "hierarchical-reasoning",
      "is_atomic": false,
      "quality": {
        "hard_in_degree": 3,
        "hard_out_degree": 1,
        "soft_in_degree": 10,
        "soft_out_degree": 1,
        "word_count": 530
      },
      "scc_id": 0
    },
    {
      "archive": "repo/30_tools_and_aux/lambda.skill",
      "cluster": "30_tools_and_aux",
      "cluster_ordinal": 30,
      "control_score": 0.325844,
      "control_state": "relay",
      "id": "lambda",
      "is_atomic": false,
      "quality": {
        "hard_in_degree": 3,
        "hard_out_degree": 3,
        "soft_in_degree": 2,
        "soft_out_degree": 5,
        "word_count": 626
      },
      "scc_id": 0
    },
    {
      "archive": "repo/30_tools_and_aux/learn.skill",
      "cluster": "30_tools_and_aux",
      "cluster_ordinal": 30,
      "control_score": 0.1925,
      "control_state": "relay",
      "id": "learn",
      "is_atomic": false,
      "quality": {
        "hard_in_degree": 1,
        "hard_out_degree": 1,
        "soft_in_degree": 1,
        "soft_out_degree": 0,
        "word_count": 288
      },
      "scc_id": 0
    },
    {
      "archive": "repo/00_meta/meta.skill",
      "cluster": "00_meta",
      "cluster_ordinal": 0,
      "control_score": 0.15,
      "control_state": "source",
      "id": "meta",
      "is_atomic": true,
      "quality": {
        "hard_in_degree": 0,
        "hard_out_degree": 2,
        "soft_in_degree": 0,
        "soft_out_degree": 2,
        "word_count": 214
      },
      "scc_id": 12
    },
    {
      "archive": "repo/30_tools_and_aux/non-linear.skill",